{
  "$schema": "https://json-schema.org/draft/2020-12/schema",
  "$id": "https://example.org/schemas/oojs-1.0-meta-schema",
  "title": "OOJS 1.0 Meta-Schema",
  "description": "JSON Schema 2020-12 document that validates OOJS 1.0 schema documents (§4–§6, §11). A file that passes this schema is structurally valid as an OOJS schema; semantic constraints that require cross-field or cross-type reasoning (e.g. no inheritance cycle, discriminator-value uniqueness, required entries must name declared properties) are enforced by the schema registry loader at parse time.",

  "type": "object",
  "required": ["$oojs", "$id", "types"],

  "properties": {

    "$oojs": {
      "description": "OOJS specification version. MUST be '1.0' (§4.2).",
      "const": "1.0"
    },

    "$id": {
      "description": "Unique URI identifying this schema (§4.3).",
      "type": "string",
      "minLength": 1
    },

    "title": {
      "description": "Human-readable short name for the schema.",
      "type": "string"
    },

    "description": {
      "description": "Human-readable description of the schema.",
      "type": "string"
    },

    "discriminator": {
      "description": "Name of the discriminator property used in all instances of this schema. Defaults to '_type' when absent (§4.5).",
      "type": "string",
      "minLength": 1
    },

    "imports": {
      "description": "Map of alias → schema URI for cross-schema type references (§4.4).",
      "type": "object",
      "propertyNames": {
        "description": "Alias name. MUST match [a-z_][A-Za-z0-9_]* (§11.3).",
        "pattern": "^[a-z_][A-Za-z0-9_]*$"
      },
      "additionalProperties": {
        "description": "URI of the imported schema.",
        "type": "string",
        "minLength": 1
      }
    },

    "types": {
      "description": "Map of type name → type definition. MUST have at least one entry (§4.6).",
      "type": "object",
      "minProperties": 1,
      "propertyNames": {
        "description": "Type name. MUST match [A-Z][A-Za-z0-9_]* and MUST NOT be a reserved primitive keyword (§11.1, §11.4).",
        "pattern": "^[A-Z][A-Za-z0-9_]*$",
        "not": { "enum": ["String", "Integer", "Number", "Boolean", "Null", "Array"] }
      },
      "additionalProperties": { "$ref": "#/$defs/TypeDefinition" }
    }

  },

  "unevaluatedProperties": true,

  "$defs": {

    "TypeName": {
      "description": "A local type name ([A-Z][A-Za-z0-9_]*) or a qualified alias-prefixed reference (alias.TypeName) (§5.2, §11.1, §11.3).",
      "type": "string",
      "pattern": "^([A-Z][A-Za-z0-9_]*|[a-z_][A-Za-z0-9_]*\\.[A-Z][A-Za-z0-9_]*)$"
    },

    "PropertyNamePattern": {
      "description": "Property name. MUST match [a-z_][A-Za-z0-9_]* (§11.2).",
      "type": "string",
      "pattern": "^[a-z_][A-Za-z0-9_]*$"
    },

    "TypeDefinition": {
      "description": "Definition of a named type within the schema (§5).",
      "type": "object",
      "properties": {

        "extends": {
          "description": "Supertype reference — local name or alias-qualified name. The referenced type MUST exist in the registry (§5.2).",
          "$ref": "#/$defs/TypeName"
        },

        "abstract": {
          "description": "When true, this type cannot be directly instantiated (§5.3).",
          "type": "boolean"
        },

        "discriminatorValue": {
          "description": "Override for the discriminator value of this type. MUST be unique across the registry (§5.4).",
          "type": "string",
          "minLength": 1
        },

        "title": {
          "description": "Human-readable short name for this type.",
          "type": "string"
        },

        "description": {
          "description": "Human-readable description of this type.",
          "type": "string"
        },

        "properties": {
          "description": "Map of property name → property definition for properties declared on this type (§5.5).",
          "type": "object",
          "propertyNames": { "$ref": "#/$defs/PropertyNamePattern" },
          "additionalProperties": { "$ref": "#/$defs/PropertyDefinition" }
        },

        "required": {
          "description": "Names of properties declared in this type's own 'properties' map that are required on every instance (§5.6).",
          "type": "array",
          "items": { "$ref": "#/$defs/PropertyNamePattern" },
          "uniqueItems": true
        }

      },
      "additionalProperties": false
    },

    "PropertyDefinition": {
      "description": "A property definition — primitive, array, or type reference — dispatched by the value of 'type' (§6).",
      "type": "object",
      "required": ["type"],
      "properties": {
        "type": { "type": "string", "minLength": 1 }
      },
      "if":   { "properties": { "type": { "const": "array" } } },
      "then": { "$ref": "#/$defs/ArrayProperty" },
      "else": {
        "if":   { "properties": { "type": { "enum": ["string", "integer", "number", "boolean", "null"] } } },
        "then": { "$ref": "#/$defs/PrimitiveProperty" },
        "else": { "$ref": "#/$defs/TypeRefProperty" }
      }
    },

    "PrimitiveProperty": {
      "description": "Property whose value is a JSON primitive (string, integer, number, boolean, or null) (§6.1).",
      "type": "object",
      "required": ["type"],
      "properties": {
        "type":        { "enum": ["string", "integer", "number", "boolean", "null"] },
        "title":       { "type": "string" },
        "description": { "type": "string" },
        "format":      { "type": "string", "description": "Semantic hint; informational in v1.0 (§6.1)." },

        "minLength":   { "type": "integer", "minimum": 0, "description": "String constraint (§6.1.1)." },
        "maxLength":   { "type": "integer", "minimum": 0, "description": "String constraint (§6.1.1)." },
        "pattern":     { "type": "string",  "description": "ECMA-262 regex; string constraint (§6.1.1)." },

        "minimum":          { "type": "number", "description": "Numeric lower bound inclusive (§6.1.2)." },
        "maximum":          { "type": "number", "description": "Numeric upper bound inclusive (§6.1.2)." },
        "exclusiveMinimum": { "type": "number", "description": "Numeric lower bound exclusive (§6.1.2)." },
        "exclusiveMaximum": { "type": "number", "description": "Numeric upper bound exclusive (§6.1.2)." },
        "multipleOf":       { "type": "number", "exclusiveMinimum": 0, "description": "Value must be a multiple of this (§6.1.2)." },

        "enum": {
          "description": "Allowed value set — array of strings for string type, array of numbers for integer/number (§6.1.1, §6.1.2).",
          "type": "array",
          "minItems": 1
        }
      },
      "additionalProperties": false
    },

    "ArrayProperty": {
      "description": "Property whose value is a homogeneous JSON array (§6.3).",
      "type": "object",
      "required": ["type", "items"],
      "properties": {
        "type":        { "const": "array" },
        "title":       { "type": "string" },
        "description": { "type": "string" },
        "minItems":    { "type": "integer", "minimum": 0 },
        "maxItems":    { "type": "integer", "minimum": 0 },
        "uniqueItems": { "type": "boolean" },
        "items":       { "$ref": "#/$defs/ArrayItemDefinition" }
      },
      "additionalProperties": false
    },

    "ArrayItemDefinition": {
      "description": "Item type definition inside an array property — either a primitive or a type reference; nested arrays are not permitted in v1.0 (§6.3).",
      "type": "object",
      "required": ["type"],
      "properties": {
        "type": { "type": "string", "minLength": 1 }
      },
      "if":   { "properties": { "type": { "enum": ["string", "integer", "number", "boolean", "null"] } } },
      "then": { "$ref": "#/$defs/PrimitiveProperty" },
      "else": { "$ref": "#/$defs/TypeRefProperty" }
    },

    "TypeRefProperty": {
      "description": "Property whose value is an instance of a named type — enables polymorphic dispatch (§6.2).",
      "type": "object",
      "required": ["type"],
      "properties": {
        "type": {
          "description": "Type name (local or alias-qualified). Must not be a primitive keyword or 'array'.",
          "$ref": "#/$defs/TypeName"
        },
        "title":       { "type": "string" },
        "description": { "type": "string" }
      },
      "additionalProperties": false
    }

  }
}
